{
  "VNF_LCM_Service_IP": "131.160.162.231",
  "CEE_Tenant_ID": "fd7ca141a54546af8283ac641bf782c4",
  "VDCID": "ba2804b3-f79f-457a-a4dd-aafe9afd8f0b",
  "VNF_MANAGER_ID": "3292ec05-d52c-41fe-b35a-a440fe4595de",
  "OSS_NOTIFICATION_SERVICE_IP": "131.160.131.51",
  "OSS_NOTIFICATION_SERVICE_HOST": "ieatENM5503-4",
  "OSS_MASTER_HOST_IP": "131.160.131.55",
  "OSS_MASTER_HOSTNAME": "ieatENM5503-8",
  "OSS_TYPE": "ENM",
  "CLOUD_MANAGER_TYPE": "CEE",
  "EXTERNAL_IP_FOR_SERVICES_VM": "131.160.162.240",
  "EXTERNAL_SUBNET_GATEWAY": "131.160.162.225",
  "EXTERNAL_SUBNET_CIDR": "131.160.162.224/27",
  "EXTERNAL_NET_ID": "7f726e26-774c-4891-bf03-0b093c6608d2",
  "SERVICES_FLAVOR": "CM-services_flavor",
  "SERVICES_IMAGE": "61bba93f-141b-4b60-8170-f75d1a5181c4",
  "VNF_SOFTWARE_VESRION": "18.16",
  "IS_PUBLIC": "false",
  "SOFTWARE_VERSION": "18.1.0.0",
  "TENANT_NAME": "ECM",
  "VNF_LCM_Service_Password": "12shroot",
  "VNF_LCM_Service_Username": "cloud-user",
  "ATLAS_Hostname": "ieatatlas01.athtem.eei.ericsson.se",
  "ATLAS_IP": "131.160.163.20",
  "CEE_Tenant_password": "Ieatecm06.laf",
  "CEE_Tenant_username": "ieatecm06_admin",
  "CEE_Tenant_name": "ieatecm06",
  "CEE_Hostname": "ieatcee01cic.athtem.eei.ericsson.se",
  "CEE_Host_IP_address": "131.160.163.12",
  "VIM_Zone_name_for_CEE": "cloud1_ecm06",
  "CORE_VM_Password": "ecm123",
  "CORE_VM_Username": "root",
  "CORE_VM_Hostname": "ieatecm06.athtem.eei.ericsson.se",
  "CORE_VM_IP": "131.160.159.241",
  "ENM_GUI_Password": "TestPassw0rd",
  "ENM_GUI_Username": "administrator",
  "ENM_GUI_Hostname": "ieatenm5503-1.athtem.eei.ericsson.se",
  "ECM_GUI_Password": "CloudAdmin123",
  "ECM_GUI_Username": "ecmadmin",
  "ECM_Host_Blade_Password": "ECM123.laf",
  "ECM_Host_Blade_username": "root",
  "ECM_Host_Blade_IP": "131.160.159.240",
  "ENVIRONMENT": "ECM06"
}
